{
  "schema_version": "1.0",
  "id": "rita",
  "version": "0.1.0",
  "status": "published",
  "category": "security-and-compliance",
  "facets": ["analysis", "investigation", "local", "read-only"],
  "risk": "high",
  "source": {
    "upstream": "https://github.com/activecm/rita",
    "reviewed_at": "2026-09-04"
  },
  "requirements": {
    "credentials": ["ClickHouse credential supplied by the harness"],
    "network_access": false,
    "tools": ["command-execution", "file-read"]
  },
  "compatibility": [
    {
      "harness": "Kubernetes CronJob with RITA",
      "version": "5.1.2",
      "verified_at": "2026-09-04",
      "result": "pass"
    }
  ],
  "evaluations": {
    "definition": "evals/definition.json",
    "baseline_report": "evals/baseline-report.md",
    "skill_report": "evals/skill-report.md"
  }
}
